name,description
able room,It is a very able room
absolute room,It is a very absolute room
adorable room,It is a very adorable room
adventurous room,It is a very adventurous room
academic room,It is a very academic room
acceptable room,It is a very acceptable room
acclaimed room,It is a very acclaimed room
accomplished room,It is a very accomplished room
accurate room,It is a very accurate room
aching room,It is a very aching room
acidic room,It is a very acidic room
acrobatic room,It is a very acrobatic room
active room,It is a very active room
actual room,It is a very actual room
adept room,It is a very adept room
admirable room,It is a very admirable room
admired room,It is a very admired room
adolescent room,It is a very adolescent room
adorable room,It is a very adorable room
adored room,It is a very adored room
advanced room,It is a very advanced room
afraid room,It is a very afraid room
affectionate room,It is a very affectionate room
aged room,It is a very aged room
aggravating room,It is a very aggravating room
aggressive room,It is a very aggressive room
agile room,It is a very agile room
agitated room,It is a very agitated room
agonizing room,It is a very agonizing room
agreeable room,It is a very agreeable room
ajar room,It is a very ajar room
alarmed room,It is a very alarmed room
alarming room,It is a very alarming room
alert room,It is a very alert room
alienated room,It is a very alienated room
alive room,It is a very alive room
all room,It is a very all room
altruistic room,It is a very altruistic room
amazing room,It is a very amazing room
ambitious room,It is a very ambitious room
ample room,It is a very ample room
amused room,It is a very amused room
amusing room,It is a very amusing room
anchored room,It is a very anchored room
ancient room,It is a very ancient room
angelic room,It is a very angelic room
angry room,It is a very angry room
anguished room,It is a very anguished room
animated room,It is a very animated room
annual room,It is a very annual room
another room,It is a very another room
antique room,It is a very antique room
anxious room,It is a very anxious room
any room,It is a very any room
apprehensive room,It is a very apprehensive room
appropriate room,It is a very appropriate room
apt room,It is a very apt room
arctic room,It is a very arctic room
arid room,It is a very arid room
aromatic room,It is a very aromatic room
artistic room,It is a very artistic room
ashamed room,It is a very ashamed room
assured room,It is a very assured room
astonishing room,It is a very astonishing room
athletic room,It is a very athletic room
attached room,It is a very attached room
attentive room,It is a very attentive room
attractive room,It is a very attractive room
austere room,It is a very austere room
authentic room,It is a very authentic room
authorized room,It is a very authorized room
automatic room,It is a very automatic room
avaricious room,It is a very avaricious room
average room,It is a very average room
aware room,It is a very aware room
awesome room,It is a very awesome room
awful room,It is a very awful room
awkward room,It is a very awkward room
babyish room,It is a very babyish room
bad room,It is a very bad room
back room,It is a very back room
baggy room,It is a very baggy room
bare room,It is a very bare room
barren room,It is a very barren room
basic room,It is a very basic room
beautiful room,It is a very beautiful room
belated room,It is a very belated room
beloved room,It is a very beloved room
beneficial room,It is a very beneficial room
better room,It is a very better room
best room,It is a very best room
bewitched room,It is a very bewitched room
big room,It is a very big room
big-hearted room,It is a very big-hearted room
biodegradable room,It is a very biodegradable room
bite-sized room,It is a very bite-sized room
bitter room,It is a very bitter room
black room,It is a very black room
black-and-white room,It is a very black-and-white room
bland room,It is a very bland room
